Movie_ID,movie_names,gross_value,imdb_ratings,metscores,movie_description,runtime,votes,certificate,certificate_id,year_release,year_id,Genre1,Genre2,Genre3,director_name,Director_id,star1,star2,star3,star4,star5,star6
733,A Haunted House,40041683,5.1,20,"Malcolm and Kisha move into their dream home, but soon learn a demon also resides there. When Kisha becomes possessed, Malcolm - determined to keep his sex life on track - turns to a priest, a psychic, and a team of ghost-busters for help.",86 min,38131,R,2,2013,4,Comedy, Fantasy            ,null,Michael Tiddes,733,Michael Tiddes, Marlon Wayans, Essence Atkins, Marlene Forte,null,null
734,Planes,90288712,5.7,39,"A cropdusting plane with a fear of heights lives his dream of competing in a famous around-the-world aerial race.",91 min,38037,PG,4,2013,4,Animation, Adventure, Comedy            ,Klay Hall,734,Klay Hall, Carlos Alazraqui, Dane Cook, Stacy Keach,null,null
735,Dhoom 3,8031955,5.4,61,"Jai and Ali return to catch the clown thief, Sahir, who has the City of Chicago captive. Watch an unconventional battle of revenge that will thrill you.",172 min,37766,Not Rated,5,2013,4,Action, Thriller            ,null,Vijay Krishna Acharya,735,Vijay Krishna Acharya, Aamir Khan, Katrina Kaif, Abhishek Bachchan,null,null
736,Starred Up,34100,7.4,81,"Eric Love is a 19 year old teenager who is so violent he has been 'Starred Up' (Moved to Adult prison) where he finds his father Neville who Eric hasn't seen since he was 5 (since he was ...                See full summaryï_ï_",106 min,36822,Not Rated,5,2013,4,Crime, Drama            ,null,David Mackenzie,736,David Mackenzie," Connell""",null,null,null,null
737,Labor Day,13362308,6.9,52,"Depressed single mom Adele and her son Henry offer a wounded, fearsome man a ride. As police search town for the escaped convict, the mother and son gradually learn his true story as their options become increasingly limited.",111 min,36048,PG-13,1,2013,4,Drama, Romance            ,null,Jason Reitman,737,Jason Reitman, Kate Winslet, Josh Brolin, Gattlin Griffith,null,null
738,Lovelace,356582,6.2,51,"The story of Linda Lovelace, who is used and abused by the porn industry at the behest of her coercive husband, before taking control of her life.",93 min,34165,R,2,2013,4,Biography, Drama            ,null,Rob Epstein,738,Rob Epstein, Jeffrey Friedman, Amanda Seyfried, James Franco, Peter Sarsgaard,null
739,The Fifth Estate,3254172,6.2,49,"A dramatic thriller based on real events that reveals the quest to expose the deceptions and corruptions of power that turned an Internet upstart into the 21st century's most fiercely debated organization.",128 min,33640,R,2,2013,4,Biography, Drama, Thriller            ,Bill Condon,739,Bill Condon, Benedict Cumberbatch, Daniel Brí__hl, Carice van Houten,null,null
740,The To Do List,3447339,5.8,61,"Feeling pressured to become more sexually experienced before she goes to college, Brandy Klark makes a list of things to accomplish before hitting campus in the fall.",104 min,32799,R,2,2013,4,Comedy, Romance            ,null,Maggie Carey,740,Maggie Carey, Aubrey Plaza, Johnny Simmons, Bill Hader,null,null
741,I Give It a Year,32514,5.7,50,"Newlywed couple Nat and Josh are deliriously happy despite their differences, though friends and family aren't convinced that they can last. With their first anniversary approaching and attractive alternatives in the mix, can they last?",97 min,32661,R,2,2013,4,Comedy, Romance            ,null,Dan Mazer,741,Dan Mazer, Rose Byrne, Rafe Spall, Alex Macqueen,null,null
742,The 100 Year-Old Man Who Climbed Out the Window and Disappeared,1083762,7.1,58,"After living a long and colorful life, Allan Karlsson finds himself stuck in a nursing home. On his 100th birthday, he leaps out a window and begins an unexpected journey.",114 min,32597,R,2,2013,4,Adventure, Comedy            ,null,Felix Herngren,742,Felix Herngren, Robert Gustafsson, Iwar Wiklander, David Wiberg,null,null
743,The Railway Man,4435083,7.1,59,"A former British Army officer, who was tortured as a prisoner of war at a Japanese labor camp during World War II, discovers that the man responsible for much of his treatment is still alive and sets out to confront him.",116 min,32393,R,2,2013,4,Biography, Drama, Romance            ,Jonathan Teplitzky,743,Jonathan Teplitzky, Colin Firth, Nicole Kidman, Stellan Skarsgí_Œ‚rd,null,null
744,The Smurfs 2,71017784,5.4,34,"The Smurfs team up with their human friends to rescue Smurfette, who has been abducted by Gargamel, since she knows a secret spell that can turn the evil sorcerer's newest creation, creatures called ""The Naughties"", into real Smurfs.",105 min,31717,PG,4,2013,4,Animation, Adventure, Comedy            ,Raja Gosnell,744,Raja Gosnell, Neil Patrick Harris, Jayma Mays, Katy Perry,null,null
745,The Last Days on Mars,23838,5.5,46,"A group of astronaut explorers succumb one by one to a mysterious and terrifying force while collecting specimens on Mars.",98 min,31682,R,2,2013,4,Horror, Sci-Fi, Thriller            ,Ruairi Robinson,745,Ruairi Robinson, Liev Schreiber, Elias Koteas, Romola Garai,null,null
746,Paranoia,7376027,5.7,32,"An entry-level employee at a powerful corporation finds himself occupying a corner office, but at a dangerous price: he must spy on his boss's old mentor to secure for him a multi-billion dollar advantage.",106 min,31610,PG-13,1,2013,4,Drama, Thriller            ,null,Robert Luketic,746,Robert Luketic, Liam Hemsworth, Gary Oldman, Harrison Ford,null,null
747,Killing Season,27713,5.4,25,"Two veterans of the Bosnian War, one American, one Serbian, find their unlikely friendship tested when one of them reveals their true intentions.",91 min,31493,R,2,2013,4,Action, Drama, Thriller            ,Mark Steven Johnson,747,Mark Steven Johnson, Robert De Niro, John Travolta, Milo Ventimiglia,null,null
748,V/H/S/2,21833,6.1,49,"Searching for a missing student, two private investigators break into his house and find collection of VHS tapes. Viewing the horrific contents of each cassette, they realize there may be dark motives behind the student's disappearance.",96 min,31098,R,2,2013,4,Horror, Thriller            ,null,Simon Barrett,748,Simon Barrett, Jason Eisener, Gareth Evans, Gregg Hale, Eduardo Sí_í_nchez, Timo Tjahjanto
749,Man of Tai Chi,100144,6.1,52,"A young martial artist's unparalleled Tai Chi skills land him in a highly lucrative underworld fight club.",105 min,31050,R,2,2013,4,Action, Drama            ,null,Keanu Reeves,749,Keanu Reeves, Tiger Hu Chen, Keanu Reeves, Karen Mok,null,null
750,Admission,18004225,5.7,48,"A Princeton admissions officer who is up for a major promotion takes a professional risk after she meets a college-bound alternative school kid who just might be the son she gave up years ago in a secret adoption.",107 min,30551,PG-13,1,2013,4,Comedy, Drama, Romance            ,Paul Weitz,750,Paul Weitz, Tina Fey, Paul Rudd, Nat Wolff,null,null
751,Kill Your Darlings,1029949,6.5,65,"A murder in 1944 draws together the great poets of the beat generation: Allen Ginsberg, Jack Kerouac and William Burroughs.",104 min,30403,R,2,2013,4,Biography, Drama, Romance            ,John Krokidas,751,John Krokidas, Daniel Radcliffe, Dane DeHaan, Michael C. Hall,null,null
752,The Green Inferno,7192291,5.3,38,"A group of student activists travels to the Amazon to save the rain forest and soon discover that they are not alone, and that no good deed goes unpunished.",100 min,29737,R,2,2013,4,Adventure, Horror, Thriller            ,Eli Roth,752,Eli Roth, Lorenza Izzo, Ariel Levy, Aaron Burns,null,null
753,Welcome to the Punch,6787,6.1,49,"When a notorious criminal is forced to return to London, it gives a detective one last chance to take down the man he's always been after.",99 min,29412,R,2,2013,4,Action, Crime, Thriller            ,Eran Creevy,753,Eran Creevy, James McAvoy, Mark Strong, Andrea Riseborough,null,null
754,In a World...,2962542,6.7,79,"An underachieving voice coach finds herself competing in the movie trailer voice-over profession against her arrogant father and his protê©gê©.",93 min,28289,R,2,2013,4,Comedy            ,null,null,Lake Bell,754,Lake Bell, Lake Bell, Fred Melamed, Michaela Watkins,null,null
755,The Machine,,6.1,52,"In efforts to construct perfect android killing machines in a war against China, UK scientists exceed their goal and create a sentient robot.",91 min,27426,R,2,2013,4,Action, Drama, Sci-Fi            ,Caradog W. James,755,Caradog W. James, Toby Stephens, Caity Lotz, Denis Lawson,null,null
756,The Grandmaster,6594959,6.5,73,"The story of martial-arts master Ip Man, the man who trained Bruce Lee.",130 min,27200,PG-13,1,2013,4,Action, Biography, Drama            ,Kar-Wai Wong,756,Kar-Wai Wong, Tony Chiu-Wai Leung, Ziyi Zhang, Jin Zhang,null,null
757,Adoration,317125,6.2,37,"A pair of childhood friends and neighbors fall for each other's sons.",112 min,27191,R,2,2013,4,Drama, Romance            ,null,Anne Fontaine,757,Anne Fontaine, Naomi Watts, Robin Wright, Xavier Samuel,null,null
758,Young & Beautiful,48022,6.8,63,"After losing her virginity, Isabelle takes up a secret life as a call girl, meeting her clients for hotel-room trysts. Throughout, she remains curiously aloof, showing little interest in the encounters themselves or the money she makes.",95 min,26655,Not Rated,5,2013,4,Drama, Romance            ,null,Franí__ois Ozon,758,Franí__ois Ozon, Marine Vacth, Gí_Œ©raldine Pailhas, Frí_Œ©dí_Œ©ric Pierrot,null,null
759,Upstream Color,444098,6.7,81,"A man and woman are drawn together, entangled in the life cycle of an ageless organism. Identity becomes an illusion as they struggle to assemble the loose fragments of wrecked lives.",96 min,26643,Not Rated,5,2013,4,Drama, Sci-Fi            ,null,Shane Carruth,759,Shane Carruth, Amy Seimetz, Frank Mosley, Shane Carruth,null,null
760,Alan Partridge: Alpha Papa,152211,6.9,66,"When famous DJ Alan Partridge's radio station is taken over by a new media conglomerate, it sets in motion a chain of events which see Alan having to work with the police to defuse a potentially violent siege.",90 min,26586,R,2,2013,4,Comedy, Crime            ,null,Declan Lowney,760,Declan Lowney, Steve Coogan, Colm Meaney, Tim Key,null,null
761,Tangerines,144501,8.3,73,"War in Georgia, Apkhazeti region in 1990. An Estonian man Ivo has stayed behind to harvest his crops of tangerines. In a bloody conflict at his door, a wounded man is left behind, and Ivo is forced to take him in.",87 min,26157,Not Rated,5,2013,4,Drama, War            ,null,Zaza Urushadze,761,Zaza Urushadze, Lembit Ulfsak, Elmo Ní__ganen, Giorgi Nakashidze,null,null
762,The Tale of the Princess Kaguya,1506975,8.1,89,"Found inside a shining stalk of bamboo by an old bamboo cutter and his wife, a tiny girl grows rapidly into an exquisite young lady. The mysterious young princess enthralls all who encounter her, but ultimately she must confront her fate, the punishment for her crime.",137 min,25066,PG,4,2013,4,Animation, Adventure, Drama            ,Isao Takahata,762,Isao Takahata, Chloí_Œ‰ Grace Moretz, James Caan, Mary Steenburgen,null,null
763,Instructions Not Included,44467206,7.6,55,"A man who has made a new life for himself and the daughter left on his doorstep 6 years ago finds his family threatened when the birth mother resurfaces.",122 min,25028,PG-13,1,2013,4,Comedy, Drama            ,null,Eugenio Derbez,763,Eugenio Derbez, Eugenio Derbez, Karla Souza, Jessica Lindsey,null,null
764,Hours,,6.5,55,"A father struggles to keep his infant daughter alive in the wake of Hurricane Katrina.",97 min,24874,PG-13,1,2013,4,Drama, Thriller            ,null,Eric Heisserer,764,Eric Heisserer, Paul Walker, Genesis Rodriguez, Nancy Nave,null,null
765,The Immigrant,2013456,6.6,77,"1921. An innocent immigrant woman is tricked into a life of burlesque and vaudeville until a dazzling magician tries to save her and reunite her with her sister who is being held in the confines of Ellis Island.",120 min,24702,R,2,2013,4,Drama, Romance            ,null,James Gray,765,James Gray, Marion Cotillard, Joaquin Phoenix, Jeremy Renner,null,null
766,How I Live Now,60213,6.5,57,"An American girl, sent to the English countryside to stay with relatives, finds love and purpose while fighting for her survival as war envelops the world around her.",101 min,24512,R,2,2013,4,Romance, Sci-Fi, Thriller            ,Kevin Macdonald,766,Kevin Macdonald, Saoirse Ronan, Tom Holland, George MacKay,null,null
767,Open Grave,,6.3,33,"A man wakes up in the wilderness, in a pit full of dead bodies, with no memory and must determine if the murderer is one of the strangers who rescued him, or if he himself is the killer.",102 min,24116,R,2,2013,4,Horror, Mystery, Thriller            ,Gonzalo Lí__pez-Gallego,767,Gonzalo Lí__pez-Gallego, Sharlto Copley, Thomas Kretschmann, Josie Ho,null,null
768,Charlie Countryman,7973,6.4,31,"While traveling abroad, a guy falls for a Romanian beauty whose unreachable heart has its origins in her violent, charismatic ex.",103 min,24053,R,2,2013,4,Comedy, Drama, Romance            ,Fredrik Bond,768,Fredrik Bond, Shia LaBeouf, Evan Rachel Wood, Mads Mikkelsen,null,null
769,Belle,10726630,7.4,64,"The mixed race daughter of a Royal Navy Admiral is raised by her aristocratic great-uncle in 18th century England.",100 min,23942,PG,4,2013,4,Biography, Drama, Romance            ,Amma Asante,769,Amma Asante, Gugu Mbatha-Raw, Matthew Goode, Emily Watson,null,null
770,Palo Alto,750100,6.2,69,"The life and struggles of a group of adolescents living in Palo Alto.",100 min,23809,R,2,2013,4,Drama            ,null,null,Gia Coppola,770,Gia Coppola, Emma Roberts, James Franco, Jack Kilmer,null,null
771,Mandela: Long Walk to Freedom,8323085,7.1,60,"A chronicle of Nelson Mandela's life journey from his childhood in a rural village through to his inauguration as the first democratically elected president of South Africa.",141 min,23666,PG-13,1,2013,4,Biography, Drama, History            ,Justin Chadwick,771,Justin Chadwick, Idris Elba, Naomie Harris, Terry Pheto,null,null
772,Tracks,508806,7.2,78,"A young woman goes on a 1,700-mile trek across the deserts of West Australia with four camels and her faithful dog.",112 min,23522,PG-13,1,2013,4,Adventure, Biography, Drama            ,John Curran,772,John Curran, Mia Wasikowska, Adam Driver, Lily Pearl,null,null
773,Dom Hemingway,518134,6.2,55,"After spending 12 years in prison for keeping his mouth shut, notorious safe-cracker Dom Hemingway is back on the streets of London looking to collect what he's owed.",93 min,23467,R,2,2013,4,Comedy, Crime, Drama            ,Richard Shepard,773,Richard Shepard, Jude Law, Richard E. Grant, Demií_í_n Bichir,null,null
774,Interstellar,188020017,8.6,74,"A team of explorers travel through a wormhole in space in an attempt to ensure humanity's survival.",169 min,1152576,PG-13,1,2014,5,Adventure, Drama, Sci-Fi            ,Christopher Nolan,774,Christopher Nolan, Matthew McConaughey, Anne Hathaway, Jessica Chastain,null,null
775,Guardians of the Galaxy,333176600,8.1,76,"A group of intergalactic criminals are forced to work together to stop a fanatical warrior from taking control of the universe.",121 min,821944,PG-13,1,2014,5,Action, Adventure, Sci-Fi            ,James Gunn,775,James Gunn, Chris Pratt, Vin Diesel, Bradley Cooper,null,null
776,Gone Girl,167767189,8.1,79,"With his wife's disappearance having become the focus of an intense media circus, a man sees the spotlight turned on him when it's suspected that he may not be innocent.",149 min,690631,R,2,2014,5,Crime, Drama, Mystery            ,David Fincher,776,David Fincher, Ben Affleck, Rosamund Pike, Neil Patrick Harris,null,null
777,Captain America: The Winter Soldier,259766572,7.8,70,"As Steve Rogers struggles to embrace his role in the modern world, he teams up with a fellow Avenger and S.H.I.E.L.D agent, Black Widow, to battle a new threat from history: an assassin known as the Winter Soldier.",136 min,583458,PG-13,1,2014,5,Action, Adventure, Sci-Fi            ,Anthony Russo,777,Anthony Russo, Joe Russo, Chris Evans, Samuel L. Jackson, Scarlett Johansson,null
778,X-Men: Days of Future Past,233921534,8,74,"The X-Men send Wolverine to the past in a desperate effort to change history and prevent an event that results in doom for both humans and mutants.",132 min,579906,PG-13,1,2014,5,Action, Adventure, Sci-Fi            ,Bryan Singer,778,Bryan Singer, Patrick Stewart, Ian McKellen, Hugh Jackman,null,null
779,The Grand Budapest Hotel,59100318,8.1,88,"The adventures of Gustave H, a legendary concierge at a famous hotel from the fictional Republic of Zubrowka between the first and second World Wars, and Zero Moustafa, the lobby boy who becomes his most trusted friend.",99 min,576302,R,2,2014,5,Adventure, Comedy, Drama            ,Wes Anderson,779,Wes Anderson, Ralph Fiennes, F. Murray Abraham, Mathieu Amalric,null,null
780,The Imitation Game,91125683,8,73,"During World War II, the English mathematical genius Alan Turing tries to crack the German Enigma code with help from fellow mathematicians.",114 min,568950,PG-13,1,2014,5,Biography, Drama, History            ,Morten Tyldum,780,Morten Tyldum, Benedict Cumberbatch, Keira Knightley, Matthew Goode,null,null
781,Whiplash,13092000,8.5,88,"A promising young drummer enrolls at a cut-throat music conservatory where his dreams of greatness are mentored by an instructor who will stop at nothing to realize a student's potential.",107 min,536789,R,2,2014,5,Drama, Music            ,null,Damien Chazelle,781,Damien Chazelle, Miles Teller, J.K. Simmons, Melissa Benoist,null,null
782,Edge of Tomorrow,100206256,7.9,71,"A soldier fighting aliens gets to relive the same day over and over again, the day restarting every time he dies.",113 min,504054,PG-13,1,2014,5,Action, Adventure, Sci-Fi            ,Doug Liman,782,Doug Liman, Tom Cruise, Emily Blunt, Bill Paxton,null,null
783,Kingsman: The Secret Service,128261724,7.7,60,"A spy organization recruits an unrefined, but promising street kid into the agency's ultra-competitive training program, just as a global threat emerges from a twisted tech genius.",129 min,499347,R,2,2014,5,Action, Adventure, Comedy            ,Matthew Vaughn,783,Matthew Vaughn, Colin Firth, Taron Egerton, Samuel L. Jackson,null,null
784,Birdman or (The Unexpected Virtue of Ignorance),42340598,7.8,88,"A washed-up actor, who once played an iconic superhero, attempts to revive his career by writing and starring in his very own Broadway play.",119 min,474362,R,2,2014,5,Comedy, Drama            ,null,Alejandro G. Ií_Œ±í_í_rritu,784,Alejandro G. Ií_Œ±í_í_rritu, Michael Keaton, Zach Galifianakis, Edward Norton,null,null
785,The Hobbit: The Battle of the Five Armies,255119788,7.4,59,"Bilbo and company are forced to engage in a war against an array of combatants and keep the Lonely Mountain from falling into the hands of a rising darkness.",144 min,409175,PG-13,1,2014,5,Adventure, Fantasy            ,null,Peter Jackson,785,Peter Jackson, Ian McKellen, Martin Freeman, Richard Armitage,null,null
786,Divergent,150947895,6.7,48,"In a world divided by factions based on virtues, Tris learns she's Divergent and won't fit in. When she discovers a plot to destroy Divergents, Tris and the mysterious Four must find out what makes Divergents dangerous before it's too late.",139 min,379095,PG-13,1,2014,5,Adventure, Mystery, Sci-Fi            ,Neil Burger,786,Neil Burger, Shailene Woodley, Theo James, Kate Winslet,null,null
787,John Wick,43037835,7.3,68,"An ex-hitman comes out of retirement to track down the gangsters that took everything from him.",101 min,376845,R,2,2014,5,Action, Crime, Thriller            ,Chad Stahelski,787,Chad Stahelski, David Leitch, Keanu Reeves, Michael Nyqvist, Alfie Allen,null
788,Ex Machina,25442958,7.7,78,"A young programmer is selected to participate in a ground-breaking experiment in synthetic intelligence by evaluating the human qualities of a breath-taking humanoid A.I.",108 min,376411,R,2,2014,5,Drama, Mystery, Sci-Fi            ,Alex Garland,788,Alex Garland, Alicia Vikander, Domhnall Gleeson, Oscar Isaac,null,null
789,Lucy,126663600,6.4,61,"A woman, accidentally caught in a dark deal, turns the tables on her captors and transforms into a merciless warrior evolved beyond human logic.",89 min,375590,R,2,2014,5,Action, Sci-Fi, Thriller            ,Luc Besson,789,Luc Besson, Scarlett Johansson, Morgan Freeman, Min-sik Choi,null,null
790,American Sniper,350126372,7.3,72,"Navy S.E.A.L. sniper Chris Kyle's pinpoint accuracy saves countless lives on the battlefield and turns him into a legend. Back home to his wife and kids after four tours of duty, however, Chris finds that it is the war he can't leave behind.",133 min,374641,R,2,2014,5,Action, Biography, Drama            ,Clint Eastwood,790,Clint Eastwood, Bradley Cooper, Sienna Miller, Kyle Gallner,null,null
791,Dawn of the Planet of the Apes,208545589,7.6,79,"A growing nation of genetically evolved apes led by Caesar is threatened by a band of human survivors of the devastating virus unleashed a decade earlier.",130 min,368360,PG-13,1,2014,5,Action, Adventure, Drama            ,Matt Reeves,791,Matt Reeves, Gary Oldman, Keri Russell, Andy Serkis,null,null
792,Nightcrawler,32381218,7.9,76,"When Louis Bloom, a con man desperate for work, muscles into the world of L.A. crime journalism, he blurs the line between observer and participant to become the star of his own story.",118 min,363722,R,2,2014,5,Crime, Drama, Thriller            ,Dan Gilroy,792,Dan Gilroy, Jake Gyllenhaal, Rene Russo, Bill Paxton,null,null
793,The Amazing Spider-Man 2,202853933,6.7,53,"When New York is put under siege by Oscorp, it is up to Spider-Man to save the city he swore to protect as well as his loved ones.",142 min,361597,PG-13,1,2014,5,Action, Adventure, Sci-Fi            ,Marc Webb,793,Marc Webb, Andrew Garfield, Emma Stone, Jamie Foxx,null,null
794,The Maze Runner,102427862,6.8,57,"Thomas is deposited in a community of boys after his memory is erased, soon learning they're all trapped in a maze that will require him to join forces with fellow ""runners"" for a shot at escape.",113 min,359937,PG-13,1,2014,5,Action, Mystery, Sci-Fi            ,Wes Ball,794,Wes Ball," Brien""",null,null,null,null
795,Fury,85817906,7.6,64,"A grizzled tank commander makes tough decisions as he and his crew fight their way across Germany in April, 1945.",134 min,353485,R,2,2014,5,Action, Drama, War            ,David Ayer,795,David Ayer, Brad Pitt, Shia LaBeouf, Logan Lerman,null,null
796,The Hunger Games: Mockingjay - Part 1,337135885,6.7,64,"Katniss Everdeen is in District 13 after she shatters the games forever. Under the leadership of President Coin and the advice of her trusted friends, Katniss spreads her wings as she fights to save Peeta and a nation moved by her courage.",123 min,352866,PG-13,1,2014,5,Action, Adventure, Sci-Fi            ,Francis Lawrence,796,Francis Lawrence, Jennifer Lawrence, Josh Hutcherson, Liam Hemsworth,null,null
797,Big Hero 6,222527828,7.8,74,"The special bond that develops between plus-sized inflatable robot Baymax, and prodigy Hiro Hamada, who team up with a group of friends to form a band of high-tech heroes.",102 min,332927,PG,4,2014,5,Animation, Action, Adventure            ,Don Hall,797,Don Hall, Chris Williams, Ryan Potter, Scott Adsit, Jamie Chung,null
798,Godzilla,200676069,6.4,62,"The world is beset by the appearance of monstrous creatures, but one of them may be the only one who can save humanity.",123 min,329554,PG-13,1,2014,5,Action, Adventure, Sci-Fi            ,Gareth Edwards,798,Gareth Edwards, Aaron Taylor-Johnson, Elizabeth Olsen, Bryan Cranston,null,null
799,The Theory of Everything,35893537,7.7,72,"A look at the relationship between the famous physicist Stephen Hawking and his wife.",123 min,323865,PG-13,1,2014,5,Biography, Drama, Romance            ,James Marsh,799,James Marsh, Eddie Redmayne, Felicity Jones, Tom Prior,null,null
800,Boyhood,25379975,7.9,100,"The life of Mason, from early childhood to his arrival at college.",165 min,300728,R,2,2014,5,Drama            ,null,null,Richard Linklater,800,Richard Linklater, Ellar Coltrane, Patricia Arquette, Ethan Hawke,null,null
801,22 Jump Street,191719337,7,71,"After making their way through high school (twice), big changes are in store for officers Schmidt and Jenko when they go deep undercover at a local college.",112 min,297987,R,2,2014,5,Action, Comedy, Crime            ,Phil Lord,801,Phil Lord, Christopher Miller, Channing Tatum, Jonah Hill, Ice Cube,null
802,The Fault in Our Stars,124872350,7.8,69,"Two teenage cancer patients begin a life-affirming journey to visit a reclusive author in Amsterdam.",126 min,290449,PG-13,1,2014,5,Drama, Romance            ,null,Josh Boone,802,Josh Boone, Shailene Woodley, Ansel Elgort, Nat Wolff,null,null
803,Maleficent,241410378,7,56,"A vengeful fairy is driven to curse an infant princess, only to discover that the child may be the one person who can restore peace to their troubled land.",97 min,283649,PG,4,2014,5,Action, Adventure, Family            ,Robert Stromberg,803,Robert Stromberg, Angelina Jolie, Elle Fanning, Sharlto Copley,null,null
804,The Lego Movie,257760692,7.8,83,"An ordinary LEGO construction worker, thought to be the prophesied as ""special"", is recruited to join a quest to stop an evil tyrant from gluing the LEGO universe into eternal stasis.",100 min,282147,PG,4,2014,5,Animation, Action, Adventure            ,Phil Lord,804,Phil Lord, Christopher Miller, Chris Pratt, Will Ferrell, Elizabeth Banks,null
