Movie_ID,movie_names,gross_value,imdb_ratings,metscores,movie_description,runtime,votes,certificate,certificate_id,year_release,year_id,Genre1,Genre2,Genre3,director_name,Director_id,star1,star2,star3,star4,star5,star6
1091,Mr. Right,25369,6.3,52,"A girl falls for the ""perfect"" guy, who happens to have a very fatal flaw: he's a hitman on the run from the crime cartels who employ him.",95 min,35936,R,2,2015,6,Action, Comedy, Romance            ,Paco Cabezas,1091,Paco Cabezas, Anna Kendrick, Sam Rockwell, Tim Roth,null,null
1092,Saul fia,1777043,7.5,89,"In the horror of 1944 Auschwitz, a prisoner forced to burn the corpses of his own people finds moral survival upon trying to salvage from the flames the body of a boy he takes for his son.",107 min,34697,R,2,2015,6,Drama, War            ,null,Lí_í_szlí__ Nemes,1092,Lí_í_szlí__ Nemes, Gí_Œ©za Rí__hrig, Levente Molní_í_r, Urs Rechn,null,null
1093,Dark Places,,6.2,39,"Libby Day was only eight years old when her family was brutally murdered in their rural Kansas farmhouse. Almost thirty years later, she reluctantly agrees to revisit the crime and uncovers the wrenching truths that led up to that tragic night.",113 min,34684,R,2,2015,6,Action, Drama, Mystery            ,Gilles Paquet-Brenner,1093,Gilles Paquet-Brenner, Charlize Theron, Nicholas Hoult, Christina Hendricks,null,null
1094,Slow West,229094,6.9,72,"A young Scottish man travels across America in pursuit of the woman he loves, attracting the attention of an outlaw who is willing to serve as a guide.",84 min,34503,R,2,2015,6,Western            ,null,null,John Maclean,1094,John Maclean, Kodi Smit-McPhee, Caren Pistorius, Aorere Paki,null,null
1095,The Ridiculous 6,,4.8,18,"An outlaw who was raised by Native Americans discovers that he has five half-brothers; together the men go on a mission to find their wayward, deadbeat dad.",119 min,34150,TV-14,7,2015,6,Comedy, Western            ,null,Frank Coraci,1095,Frank Coraci, Adam Sandler, Terry Crews, Jorge Garcia,null,null
1096,The Lazarus Effect,25799043,5.2,31,"A group of medical researchers discover a way to bring dead patients back to life.",83 min,33832,PG-13,1,2015,6,Horror, Mystery, Sci-Fi            ,David Gelb,1096,David Gelb, Olivia Wilde, Mark Duplass, Evan Peters,null,null
1097,Yip Man 3,2679437,7.1,57,"When a band of brutal gangsters led by a crooked property developer make a play to take over a local school, Master Ip is forced to take a stand.",105 min,33627,PG-13,1,2015,6,Action, Biography, Drama            ,Wilson Yip,1097,Wilson Yip, Donnie Yen, Lynn Hung, Jin Zhang,null,null
1098,The Transporter Refueled,16027866,5.2,32,"In the south of France, former special-ops mercenary Frank Martin enters into a game of chess with a femme-fatale and her three sidekicks who are looking for revenge against a sinister Russian kingpin.",96 min,33531,PG-13,1,2015,6,Action, Adventure, Crime            ,Camille Delamarre,1098,Camille Delamarre, Ed Skrein, Loan Chabanol, Ray Stevenson,null,null
1099,The Gunman,10640645,5.8,39,"A sniper on a mercenary assassination team, kills the minister of mines of the Congo. Terrier's successful kill shot forces him into hiding. Returning to the Congo years later, he becomes the target of a hit squad himself.",115 min,33325,R,2,2015,6,Action, Crime, Drama            ,Pierre Morel,1099,Pierre Morel, Sean Penn, Idris Elba, Jasmine Trinca,null,null
1100,Last Knights,,6.2,27,"A fallen warrior rises against a corrupt and sadistic ruler to avenge his dishonored master.",115 min,33031,R,2,2015,6,Action, Adventure            ,null,Kazuaki Kiriya,1100,Kazuaki Kiriya, Clive Owen, Morgan Freeman, Aksel Hennie,null,null
1101,Hot Tub Time Machine 2,12282677,5.1,29,"When Lou finds himself in trouble, Nick and Jacob fire up the hot tub time machine in an attempt to get back to the past. But they inadvertently land in the future with Adam Jr. Now they ...                See full summaryï_ï_",93 min,32482,R,2,2015,6,Comedy, Sci-Fi            ,null,Steve Pink,1101,Steve Pink, Rob Corddry, Craig Robinson, Clark Duke,null,null
1102,The Boy Next Door,35385560,4.7,30,"A woman, separated from her unfaithful husband, falls for a younger man who has moved in next door, but their torrid affair soon takes a dangerous turn.",91 min,32347,R,2,2015,6,Mystery, Thriller            ,null,Rob Cohen,1102,Rob Cohen, Jennifer Lopez, Ryan Guzman, Kristin Chenoweth,null,null
1103,Sleeping with Other People,814775,6.5,64,"A good-natured womanizer and a serial cheater form a platonic relationship that helps reform them in ways, while a mutual attraction sets in.",101 min,31831,R,2,2015,6,Comedy, Drama, Romance            ,Leslye Headland,1103,Leslye Headland, Jason Sudeikis, Alison Brie, Jordan Carlos,null,null
1104,Secret in Their Eyes,20180155,6.3,45,"A tight-knit team of rising investigators, along with their supervisor, is suddenly torn apart when they discover that one of their own teenage daughters has been brutally murdered.",111 min,31639,PG-13,1,2015,6,Crime, Drama, Mystery            ,Billy Ray,1104,Billy Ray, Chiwetel Ejiofor, Nicole Kidman, Julia Roberts,null,null
1105,Going Clear: Scientology & the Prison of Belief,,8,80,"A film that claims to be a look at the inner-workings of the Church of Scientology.",119 min,31271,Not Rated,5,2015,6,Documentary            ,null,null,Alex Gibney,1105,Alex Gibney, Paul Haggis, Jason Beghe, Spanky Taylor,null,null
1106,A Man Called Ove,3358518,7.7,70,"Ove, an ill-tempered, isolated retiree who spends his days enforcing block association rules and visiting his wife's grave, has finally given up on life just as an unlikely friendship develops with his boisterous new neighbors.",116 min,31076,PG-13,1,2015,6,Comedy, Drama, Romance            ,Hannes Holm,1106,Hannes Holm, Rolf Lassgí_Œ‚rd, Bahar Pars, Filip Berg,null,null
1107,Absolutely Anything,,6,31,"A group of eccentric aliens confer a human being with the power to do absolutely anything, as an experiment.",85 min,30512,R,2,2015,6,Comedy, Sci-Fi            ,null,Terry Jones,1107,Terry Jones, Simon Pegg, Kate Beckinsale, Sanjeev Bhaskar,null,null
1108,Suffragette,4693356,6.9,67,"The foot soldiers of the early feminist movement, women who were forced underground to pursue a dangerous game of cat and mouse with an increasingly brutal State.",106 min,30505,PG-13,1,2015,6,Biography, Drama, History            ,Sarah Gavron,1108,Sarah Gavron, Carey Mulligan, Anne-Marie Duff, Helena Bonham Carter,null,null
1109,High-Rise,343139,5.6,65,"Life for the residents of a tower block begins to run out of control.",119 min,30077,R,2,2015,6,Drama            ,null,null,Ben Wheatley,1109,Ben Wheatley, Tom Hiddleston, Jeremy Irons, Sienna Miller,null,null
1110,Regression,54734,5.7,32,"A detective and a psychoanalyst uncover evidence of a satanic cult while investigating the rape of a young woman.",106 min,29756,R,2,2015,6,Crime, Drama, Mystery            ,Alejandro Amení_í_bar,1110,Alejandro Amení_í_bar, Ethan Hawke, David Thewlis, Emma Watson,null,null
1111,Shaun the Sheep Movie,19375982,7.4,81,"When Shaun decides to take the day off and have some fun, he gets a little more action than he bargained for. A mix up with the Farmer, a caravan and a very steep hill lead them all to the Big City and it's up to Shaun and the flock to return everyone safely to the green grass of home.",85 min,29696,PG,4,2015,6,Animation, Adventure, Comedy            ,Mark Burton,1111,Mark Burton, Richard Starzak, Justin Fletcher, John Sparkes, Omid Djalili,null
1112,The 33,12188642,6.9,55,"Based on the real-life event, when a gold and copper mine collapses, it traps 33 miners underground for 69 days.",127 min,29295,PG-13,1,2015,6,Biography, Drama, History            ,Patricia Riggen,1112,Patricia Riggen, Antonio Banderas, Rodrigo Santoro, Juliette Binoche,null,null
1113,We Are Your Friends,3590010,6.2,46,"Caught between a forbidden romance and the expectations of his friends, aspiring DJ Cole Carter attempts to find the path in life that leads to fame and fortune.",96 min,29113,R,2,2015,6,Drama, Music, Romance            ,Max Joseph,1113,Max Joseph, Zac Efron, Wes Bentley, Emily Ratajkowski,null,null
1114,"McFarland, USA",44469602,7.4,60,"Jim White moves his family after losing his last job as a football coach. He sees that some of the students are worth starting a cross-country team and turns seven students with no hope into one of the best cross-country teams.",129 min,28846,PG,4,2015,6,Biography, Drama, Sport            ,Niki Caro,1114,Niki Caro, Kevin Costner, Maria Bello, Ramiro Rodriguez,null,null
1115,Love,,6,51,"Murphy is an American living in Paris who enters a highly sexually and emotionally charged relationship with the unstable Electra. Unaware of the effect it will have on their relationship, they invite their pretty neighbor into their bed.",135 min,28510,Not Rated,5,2015,6,Drama, Romance            ,null,Gaspar Noí_Œ©,1115,Gaspar Noí_Œ©, Aomi Muyock, Karl Glusman, Klara Kristin,null,null
1116,Paul Blart: Mall Cop 2,71038190,4.4,13,"After six years of keeping our malls safe, Paul Blart has earned a well-deserved vacation. He heads to Vegas with his teenage daughter before she heads off to college. But safety never takes a holiday and when duty calls, Blart answers.",94 min,28187,PG,4,2015,6,Action, Comedy, Crime            ,Andy Fickman,1116,Andy Fickman, Kevin James, Raini Rodriguez, Eduardo Verí_í_stegui,null,null
1117,Mustang,845464,7.6,83,"When five orphan girls are seen innocently playing with boys on a beach, their scandalized conservative guardians confine them while forced marriages are arranged.",97 min,27031,PG-13,1,2015,6,Drama            ,null,null,Deniz Gamze Ergí__ven,1117,Deniz Gamze Ergí__ven, Gí__nes Sensoy, Doga Zeynep Doguslu, Tugba Sunguroglu,null,null
1118,The Second Best Exotic Marigold Hotel,33078266,6.6,51,"As the Best Exotic Marigold Hotel has only a single remaining vacancy - posing a rooming predicament for two fresh arrivals - Sonny pursues his expansionist dream of opening a second hotel.",122 min,26820,PG,4,2015,6,Comedy, Drama            ,null,John Madden,1118,John Madden, Judi Dench, Maggie Smith, Bill Nighy,null,null
1119,The Final Girls,,6.6,59,"A young woman grieving the loss of her mother, a famous scream queen from the 1980s, finds herself pulled into the world of her mom's most famous movie. Reunited, the women must fight off the film's maniacal killer.",88 min,26719,PG-13,1,2015,6,Comedy, Horror            ,null,Todd Strauss-Schulson,1119,Todd Strauss-Schulson, Taissa Farmiga, Malin Akerman, Adam Devine,null,null
1120,Unfinished Business,10214013,5.4,32,"A hard-working small business owner and his two associates travel to Europe to close the most important deal of their lives. But what began as a routine business trip goes off the rails in every way imaginable - and unimaginable.",91 min,26661,R,2,2015,6,Comedy            ,null,null,Ken Scott,1120,Ken Scott, Vince Vaughn, Dave Franco, Tom Wilkinson,null,null
1121,The Stanford Prison Experiment,643557,6.9,67,"In 1971, twenty-four male students are selected to take on randomly assigned roles of prisoners and guards in a mock prison situated in the basement of the Stanford psychology building.",122 min,26624,R,2,2015,6,Biography, Drama, History            ,Kyle Patrick Alvarez,1121,Kyle Patrick Alvarez, Ezra Miller, Tye Sheridan, Billy Crudup,null,null
1122,Survivor,,5.6,28,"A Foreign Service Officer in London tries to prevent a terrorist attack set to hit New York City, but is forced to go on the run when she is framed for crimes she did not commit.",96 min,25965,PG-13,1,2015,6,Action, Crime, Thriller            ,James McTeigue,1122,James McTeigue, Milla Jovovich, Pierce Brosnan, Dylan McDermott,null,null
1123,Danny Collins,5348317,7,58,"An aging rock star decides to change his life when he discovers a 40-year-old letter written to him by John Lennon.",106 min,25530,R,2,2015,6,Comedy, Drama, Music            ,Dan Fogelman,1123,Dan Fogelman, Al Pacino, Annette Bening, Jennifer Garner,null,null
1124,45 Years,4250507,7.1,94,"A married couple preparing to celebrate their wedding anniversary receives shattering news that promises to forever change the course of their lives.",91 min,25249,R,2,2015,6,Drama, Romance            ,null,Andrew Haigh,1124,Andrew Haigh, Charlotte Rampling, Tom Courtenay, Geraldine James,null,null
1125,Cop Car,128002,6.3,66,"A small-town sheriff sets out to find the two kids who have taken his car on a joy ride.",88 min,25136,R,2,2015,6,Crime, Thriller            ,null,Jon Watts,1125,Jon Watts, Kevin Bacon, James Freedson-Jackson, Hays Wellford,null,null
1126,The Diary of a Teenage Girl,1477002,6.9,87,"A teen artist living in 1970s San Francisco enters into an affair with her mother's boyfriend.",102 min,24590,R,2,2015,6,Drama, Romance            ,null,Marielle Heller,1126,Marielle Heller, Bel Powley, Alexander Skarsgí_Œ‚rd, Kristen Wiig,null,null
1127,Cobain: Montage of Heck,,7.5,83,"An authorized documentary on the late musician Kurt Cobain, from his early days in Aberdeen, Washington to his success and downfall with the grunge band Nirvana.",145 min,24327,TV-MA,8,2015,6,Documentary, Animation, Biography            ,Brett Morgen,1127,Brett Morgen, Aaron Burckhard, Chad Channing, Don Cobain,null,null
1128,The End of the Tour,2993669,7.3,82,"The story of the five-day interview between Rolling Stone reporter David Lipsky and acclaimed novelist David Foster Wallace, which took place right after the 1996 publication of Wallace's groundbreaking epic novel, 'Infinite Jest.'",106 min,23186,R,2,2015,6,Biography, Drama            ,null,James Ponsoldt,1128,James Ponsoldt, Jason Segel, Jesse Eisenberg, Anna Chlumsky,null,null
1129,Z for Zachariah,118483,6,68,"In the wake of a disaster that wipes out most of civilization, two men and a young woman find themselves in an emotionally charged love triangle as the last known survivors.",98 min,22987,PG-13,1,2015,6,Drama, Sci-Fi, Thriller            ,Craig Zobel,1129,Craig Zobel, Chiwetel Ejiofor, Chris Pine,null,null,null
1130,Max,42652003,6.8,47,"A Malinois dog that helped American Marines in Afghanistan returns to the United States and is adopted by his handler's family after suffering a traumatic experience.",111 min,22792,PG,4,2015,6,Adventure, Drama, Family            ,Boaz Yakin,1130,Boaz Yakin, Thomas Haden Church, Josh Wiggins, Luke Kleintank,null,null
1131,Le tout nouveau testament,89182,7.1,70,"Did you know that God is alive and lives in Brussels with his daughter?",114 min,22740,Not Rated,5,2015,6,Comedy, Fantasy            ,null,Jaco Van Dormael,1131,Jaco Van Dormael, Pili Groyne, Benoí_Œåt Poelvoorde, Catherine Deneuve,null,null
1132,Bê»lgen,176637,6.7,68,"Although anticipated, no one is really ready when the mountain pass above the scenic, narrow Norwegian fjord Geiranger collapses and creates an 85-meter high violent tsunami. A geologist is one of those caught in the middle of it.",105 min,22378,R,2,2015,6,Action, Drama, Thriller            ,Roar Uthaug,1132,Roar Uthaug, Kristoffer Joner, Ane Dahl Torp, Jonas Hoff Oftebro,null,null
1133,Heist,,6.1,37,"A father is without the means to pay for his daughter's medical treatment. As a last resort, he partners with a greedy co-worker to rob a casino. When things go awry they're forced to hijack a city bus.",93 min,22054,R,2,2015,6,Action, Crime, Thriller            ,Scott Mann,1133,Scott Mann, Robert De Niro, Jeffrey Dean Morgan, Dave Bautista,null,null
1134,Under sandet,435266,7.8,75,"In post-World War II Denmark, a group of young German POWs are forced to clear a beach of thousands of land mines under the watch of a Danish Sergeant who slowly learns to appreciate their plight.",100 min,21582,R,2,2015,6,Drama, History, War            ,Martin Zandvliet,1134,Martin Zandvliet, Roland Mí_Œôller, Louis Hofmann, Joel Basman,null,null
1135,Turbo Kid,50000,6.7,60,"In a post-apocalyptic wasteland in 1997, a comic book fan adopts the persona of his favourite hero to save his enthusiastic friend and fight a tyrannical overlord.",93 min,21334,Not Rated,5,2015,6,Action, Adventure, Comedy            ,Franí__ois Simard,1135,Franí__ois Simard, Anouk Whissell, Yoann-Karl Whissell, Munro Chambers, Laurence Leboeuf, Michael Ironside
1136,Mistress America,2461121,6.7,75,"A lonely college freshman's life is turned upside-down by her impetuous, adventurous stepsister-to-be.",84 min,20677,R,2,2015,6,Comedy, Drama            ,null,Noah Baumbach,1136,Noah Baumbach, Greta Gerwig, Lola Kirke, Shana Dowdeswell,null,null
1137,Equals,32095,6,43,"In an emotionless utopia, two people fall in love when they regain their feelings from a mysterious disease, causing tensions between them and their society.",101 min,20434,PG-13,1,2015,6,Drama, Romance, Sci-Fi            ,Drake Doremus,1137,Drake Doremus, Nicholas Hoult, Kristen Stewart, Vernetta Lopez,null,null
1138,Paranormal Activity: The Ghost Dimension,18300124,4.6,30,"Using a special camera that can see spirits, a family must protect their daughter from an evil entity with a sinister plan.",88 min,20343,R,2,2015,6,Horror            ,null,null,Gregory Plotkin,1138,Gregory Plotkin, Chris J. Murray, Brit Shaw, Ivy George,null,null
1139,Tale of Tales,80809,6.4,72,"From the bitter quest of the Queen of Longtrellis, to two mysterious sisters who provoke the passion of a king, to the King of Highhills obsessed with a giant Flea, these tales are inspired by the fairytales by Giambattista Basile.",134 min,20065,R,2,2015,6,Drama, Fantasy, Horror            ,Matteo Garrone,1139,Matteo Garrone, Salma Hayek, Vincent Cassel, Toby Jones,null,null
1140,Knight of Cups,558402,5.7,53,"A writer indulging in all that Los Angeles and Las Vegas has to offer undertakes a search for love and self via a series of adventures with six different women.",118 min,20053,R,2,2015,6,Drama, Romance            ,null,Terrence Malick,1140,Terrence Malick, Christian Bale, Cate Blanchett, Natalie Portman,null,null
1141,Little Boy,6420319,7.4,30,"An eight-year-old boy is willing to do whatever it takes to end World War II so he can bring his father home. The story reveals the indescribable love a father has for his little boy and the love a son has for his father.",106 min,19840,PG-13,1,2015,6,Drama, History, War            ,Alejandro Monteverde,1141,Alejandro Monteverde, Jakob Salvati, Emily Watson, David Henrie,null,null
1142,A Walk in the Woods,29467855,6.3,51,"After spending two decades in England, Bill Bryson returns to the U.S., where he decides the best way to connect with his homeland is to hike the Appalachian Trail with one of his oldest friends.",104 min,19705,R,2,2015,6,Adventure, Biography, Comedy            ,Ken Kwapis,1142,Ken Kwapis, Robert Redford, Nick Nolte, Emma Thompson,null,null
1143,The Lady in the Van,10017675,6.7,70,"A man forms an unexpected bond with a transient woman living in her van that's parked in his driveway.",104 min,19628,PG-13,1,2015,6,Biography, Comedy, Drama            ,Nicholas Hytner,1143,Nicholas Hytner, Maggie Smith, Alex Jennings, Jim Broadbent,null,null
1144,Ricki and the Flash,26822144,6,54,"A musician who gave up everything for her dream of rock-and-roll stardom returns home, looking to make things right with her family.",101 min,19206,PG-13,1,2015,6,Comedy, Drama, Music            ,Jonathan Demme,1144,Jonathan Demme, Meryl Streep, Kevin Kline, Mamie Gummer,null,null
1145,Tangerine,701837,7.1,85,"A hooker tears through Tinseltown on Christmas Eve searching for the pimp who broke her heart.",88 min,19114,R,2,2015,6,Comedy, Crime, Drama            ,Sean Baker,1145,Sean Baker, Kitana Kiki Rodriguez, Mya Taylor, Karren Karagulian,null,null
1146,A Bigger Splash,1982505,6.4,74,"The vacation of a famous rock star and her boyfriend in Italy is disrupted by the unexpected visit of an old friend and his daughter.",125 min,19017,R,2,2015,6,Drama, Thriller            ,null,Luca Guadagnino,1146,Luca Guadagnino, Tilda Swinton, Matthias Schoenaerts, Ralph Fiennes,null,null
1147,Where to Invade Next,3820195,7.6,64,"To learn what the USA can learn from other nations, Michael Moore playfully ""invades"" them to see what they have to offer.",120 min,18936,R,2,2015,6,Documentary, Comedy            ,null,Michael Moore,1147,Michael Moore, Michael Moore, Johnny Fancelli, Christina Fancelli,null,null
1148,Fathers & Daughters,,7.1,31,"A Pulitzer-winning writer grapples with being a widower and father after a mental breakdown, while, 27 years later, his grown daughter struggles to forge connections of her own.",116 min,18515,R,2,2015,6,Drama            ,null,null,Gabriele Muccino,1148,Gabriele Muccino, Russell Crowe, Amanda Seyfried, Aaron Paul,null,null
1149,Our Brand Is Crisis,6998324,6.1,53,"A battle-hardened American political consultant is sent to help re-elect a controversial president in Bolivia, where she must compete with a long-term rival working for another candidate.",107 min,17133,R,2,2015,6,Comedy, Drama            ,null,David Gordon Green,1149,David Gordon Green, Sandra Bullock, Billy Bob Thornton, Anthony Mackie,null,null
1150,Jane Got a Gun,1512815,5.9,49,"A woman asks her ex-lover for help in order to save her outlaw husband from a gang out to kill him.",98 min,16922,R,2,2015,6,Action, Drama, Western            ,Gavin O'Connor,1150,"Connor""",null,null,null,null,null
1151,MI-5,,6.2,47,"When a terrorist escapes custody during a routine handover, Will Holloway must team with disgraced MI5 Intelligence Chief Harry Pearce to track him down before an imminent terrorist attack on London.",104 min,16774,R,2,2015,6,Action, Drama, Thriller            ,Bharat Nalluri,1151,Bharat Nalluri, Kit Harington, Peter Firth, Jennifer Ehle,null,null
1152,Deadpool,363070709,8,65,"A fast-talking mercenary with a morbid sense of humor is subjected to a rogue experiment that leaves him with accelerated healing powers and a quest for revenge.",108 min,706671,R,2,2016,7,Action, Adventure, Comedy            ,Tim Miller,1152,Tim Miller, Ryan Reynolds, Morena Baccarin, T.J. Miller,null,null
1153,Batman v Superman: Dawn of Justice,330360194,6.6,44,"Fearing that the actions of Superman are left unchecked, Batman takes on the Man of Steel, while the world wrestles with what kind of a hero it really needs.",151 min,524919,PG-13,1,2016,7,Action, Adventure, Fantasy            ,Zack Snyder,1153,Zack Snyder, Ben Affleck, Henry Cavill, Amy Adams,null,null
1154,Captain America: Civil War,408084349,7.8,75,"Political involvement in the Avengers' activities causes a rift between Captain America and Iron Man.",147 min,477889,PG-13,1,2016,7,Action, Adventure, Sci-Fi            ,Anthony Russo,1154,Anthony Russo, Joe Russo, Chris Evans, Robert Downey Jr., Scarlett Johansson,null
1155,Suicide Squad,325100054,6.1,40,"A secret government agency recruits some of the most dangerous incarcerated super-villains to form a defensive task force. Their first mission: save the world from the apocalypse.",123 min,468904,PG-13,1,2016,7,Action, Adventure, Fantasy            ,David Ayer,1155,David Ayer, Will Smith, Jared Leto, Margot Robbie,null,null
1156,Arrival,100546139,7.9,81,"A linguist is recruited by the military to communicate with alien lifeforms after twelve mysterious spacecrafts land around the world.",116 min,437155,PG-13,1,2016,7,Drama, Mystery, Sci-Fi            ,Denis Villeneuve,1156,Denis Villeneuve, Amy Adams, Jeremy Renner, Forest Whitaker,null,null
1157,Rogue One,532177324,7.8,65,"The daughter of an Imperial scientist joins the Rebel Alliance in a risky move to steal the Death Star plans.",133 min,413457,PG-13,1,2016,7,Action, Adventure, Sci-Fi            ,Gareth Edwards,1157,Gareth Edwards, Felicity Jones, Diego Luna, Alan Tudyk,null,null
1158,Doctor Strange,232641920,7.5,72,"While on a journey of physical and spiritual healing, a brilliant neurosurgeon is drawn into the world of the mystic arts.",115 min,393186,PG-13,1,2016,7,Action, Adventure, Fantasy            ,Scott Derrickson,1158,Scott Derrickson, Benedict Cumberbatch, Chiwetel Ejiofor, Rachel McAdams,null,null
1159,La La Land,151101803,8.1,93,"While navigating their careers in Los Angeles, a pianist and an actress fall in love while attempting to reconcile their aspirations for the future.",128 min,357740,PG-13,1,2016,7,Comedy, Drama, Music            ,Damien Chazelle,1159,Damien Chazelle, Ryan Gosling, Emma Stone, Rosemarie DeWitt,null,null
1160,Zootopia,341268248,8,78,"In a city of anthropomorphic animals, a rookie bunny cop and a cynical con artist fox must work together to uncover a conspiracy.",108 min,337675,PG,4,2016,7,Animation, Adventure, Comedy            ,Byron Howard,1160,Byron Howard, Rich Moore, Jared Bush, Ginnifer Goodwin, Jason Bateman, Idris Elba
1161,X-Men: Apocalypse,155442489,7,52,"After the re-emergence of the world's first mutant, world-destroyer Apocalypse, the X-Men must unite to defeat his extinction level plan.",144 min,312802,PG-13,1,2016,7,Action, Adventure, Sci-Fi            ,Bryan Singer,1161,Bryan Singer, James McAvoy, Michael Fassbender, Jennifer Lawrence,null,null
1162,Hacksaw Ridge,67209615,8.2,71,"WWII American Army Medic Desmond T. Doss, who served during the Battle of Okinawa, refuses to kill people, and becomes the first man in American history to receive the Medal of Honor without firing a shot.",139 min,305758,R,2,2016,7,Biography, Drama, History            ,Mel Gibson,1162,Mel Gibson, Andrew Garfield, Sam Worthington, Luke Bracey,null,null
1163,Fantastic Beasts and Where to Find Them,234037575,7.4,66,"The adventures of writer Newt Scamander in New York's secret community of witches and wizards seventy years before Harry Potter reads his book in school.",133 min,295790,PG-13,1,2016,7,Adventure, Family, Fantasy            ,David Yates,1163,David Yates, Eddie Redmayne, Katherine Waterston, Alison Sudol,null,null
