Movie_ID,movie_names,gross_value,imdb_ratings,metscores,movie_description,runtime,votes,certificate,certificate_id,year_release,year_id,Genre1,Genre2,Genre3,director_name,Director_id,star1,star2,star3,star4,star5,star6
1,Inception,292576195,8.8,74,"A thief, who steals corporate secrets through the use of dream-sharing technology, is given the inverse task of planting an idea into the mind of a CEO.",148 min,1685228,PG-13,1,2010,1,Action, Adventure, Sci-Fi            ,Christopher Nolan,1,Christopher Nolan, Leonardo DiCaprio, Joseph Gordon-Levitt, Ellen Page,null,null
2,Shutter Island,128012934,8.1,63,"In 1954, a U.S. Marshal investigates the disappearance of a murderer, who escaped from a hospital for the criminally insane.",138 min,918537,R,2,2010,1,Mystery, Thriller            ,null,Martin Scorsese,2,Martin Scorsese, Leonardo DiCaprio, Emily Mortimer, Mark Ruffalo,null,null
3,Toy Story 3,415004880,8.3,92,"The toys are mistakenly delivered to a day-care center instead of the attic right before Andy leaves for college, and it's up to Woody to convince the other toys that they weren't abandoned and to return home.",103 min,625075,G,3,2010,1,Animation, Adventure, Comedy            ,Lee Unkrich,3,Lee Unkrich, Tom Hanks, Tim Allen, Joan Cusack,null,null
4,Black Swan,106954678,8,79,"A committed dancer wins the lead role in a production of Tchaikovsky's ""Swan Lake"" only to find herself struggling to maintain her sanity.",108 min,609195,R,2,2010,1,Drama, Thriller            ,null,Darren Aronofsky,4,Darren Aronofsky, Natalie Portman, Mila Kunis, Vincent Cassel,null,null
5,Iron Man 2,312433331,7,57,"With the world now aware of his identity as Iron Man, Tony Stark must contend with both his declining health and a vengeful mad man with ties to his father's legacy.",124 min,590193,PG-13,1,2010,1,Action, Adventure, Sci-Fi            ,Jon Favreau,5,Jon Favreau, Robert Downey Jr., Mickey Rourke, Gwyneth Paltrow,null,null
6,The King's Speech,138797449,8,88,"The story of King George VI of the United Kingdom of Great Britain and Northern Ireland, his impromptu ascension to the throne and the speech therapist who helped the unsure monarch become worthy of it.",118 min,558931,R,2,2010,1,Biography, Drama            ,null,Tom Hooper,6,Tom Hooper, Colin Firth, Geoffrey Rush, Helena Bonham Carter,null,null
7,How to Train Your Dragon,217581231,8.1,74,"A hapless young Viking who aspires to hunt dragons becomes the unlikely friend of a young dragon himself, and learns there may be more to the creatures than he assumed.",98 min,557642,PG,4,2010,1,Animation, Action, Adventure            ,Dean DeBlois,7,Dean DeBlois, Chris Sanders, Jay Baruchel, Gerard Butler, Christopher Mintz-Plasse,null
8,The Social Network,96962694,7.7,95,"Harvard student Mark Zuckerberg creates the social networking site that would become known as Facebook, but is later sued by two brothers who claimed he stole their idea, and the co-founder who was later squeezed out of the business.",120 min,536020,PG-13,1,2010,1,Biography, Drama            ,null,David Fincher,8,David Fincher, Jesse Eisenberg, Andrew Garfield, Justin Timberlake,null,null
9,Kick-Ass,48071303,7.6,66,"Dave Lizewski is an unnoticed high school student and comic book fan who one day decides to become a superhero, even though he has no powers, training or meaningful reason to do so.",117 min,474713,R,2,2010,1,Action, Comedy            ,null,Matthew Vaughn,9,Matthew Vaughn, Aaron Taylor-Johnson, Nicolas Cage, Chloí_Œ‰ Grace Moretz,null,null
10,Despicable Me,251513985,7.7,72,"When a criminal mastermind uses a trio of orphan girls as pawns for a grand scheme, he finds their love is profoundly changing him for the better.",95 min,433295,PG,4,2010,1,Animation, Adventure, Comedy            ,Pierre Coffin,10,Pierre Coffin, Chris Renaud, Steve Carell, Jason Segel, Russell Brand,null
11,Harry Potter and the Deathly Hallows: Part 1,295983305,7.7,65,"As Harry races against time and evil to destroy the Horcruxes, he uncovers the existence of three most powerful objects in the wizarding world: the Deathly Hallows.",146 min,383804,PG-13,1,2010,1,Adventure, Family, Fantasy            ,David Yates,11,David Yates, Daniel Radcliffe, Emma Watson, Rupert Grint,null,null
12,Alice in Wonderland,334191110,6.5,53,"Nineteen-year-old Alice returns to the magical world from her childhood adventure, where she reunites with her old friends and learns of her true destiny: to end the Red Queen's reign of terror.",108 min,338619,PG,4,2010,1,Adventure, Family, Fantasy            ,Tim Burton,12,Tim Burton, Mia Wasikowska, Johnny Depp, Helena Bonham Carter,null,null
13,Tangled,200821936,7.8,71,"The magically long-haired Rapunzel has spent her entire life in a tower, but now that a runaway thief has stumbled upon her, she is about to discover the world for the first time, and who she really is.",100 min,335860,PG,4,2010,1,Animation, Adventure, Comedy            ,Nathan Greno,13,Nathan Greno, Byron Howard, Mandy Moore, Zachary Levi, Donna Murphy,null
14,Scott Pilgrim vs. the World,31494270,7.5,69,"Scott Pilgrim must defeat his new girlfriend's seven evil exes in order to win her heart.",112 min,312009,PG-13,1,2010,1,Action, Comedy, Romance            ,Edgar Wright,14,Edgar Wright, Michael Cera, Mary Elizabeth Winstead, Kieran Culkin,null,null
15,Easy A,58401464,7.1,72,"A clean-cut high school student relies on the school's rumor mill to advance her social and financial standing.",92 min,309764,PG-13,1,2010,1,Comedy, Drama, Romance            ,Will Gluck,15,Will Gluck, Emma Stone, Amanda Bynes, Penn Badgley,null,null
16,127 Hours,18335230,7.6,82,"An adventurous mountain climber becomes trapped under a boulder while canyoneering alone near Moab, Utah and resorts to desperate measures in order to survive.",94 min,306873,R,2,2010,1,Adventure, Biography, Drama            ,Danny Boyle,16,Danny Boyle, James Franco, Amber Tamblyn, Kate Mara,null,null
17,The Town,92186262,7.6,74,"As he plans his next job, a longtime thief tries to balance his feelings for a bank manager connected to one of his earlier heists, as well as the F.B.I. Agent looking to bring him and his crew down.",125 min,305816,R,2,2010,1,Crime, Drama, Thriller            ,Ben Affleck,17,Ben Affleck, Ben Affleck, Rebecca Hall, Jon Hamm,null,null
18,The Fighter,93617009,7.8,79,"A look at the early years of boxer ""Irish"" Micky Ward and his brother who helped train him before going pro in the mid 1980s.",116 min,301163,R,2,2010,1,Biography, Drama, Sport            ,David O. Russell,18,David O. Russell, Mark Wahlberg, Christian Bale, Amy Adams,null,null
19,The Expendables,103068524,6.5,45,"A CIA operative hires a team of mercenaries to eliminate a Latin dictator and a renegade CIA agent.",103 min,294012,R,2,2010,1,Action, Adventure, Thriller            ,Sylvester Stallone,19,Sylvester Stallone, Sylvester Stallone, Jason Statham, Jet Li,null,null
20,Due Date,100539043,6.6,51,"High-strung father-to-be Peter Highman is forced to hitch a ride with aspiring actor Ethan Tremblay on a road trip in order to make it to his child's birth on time.",95 min,291402,R,2,2010,1,Action, Adventure, Comedy            ,Todd Phillips,20,Todd Phillips, Robert Downey Jr., Zach Galifianakis, Michelle Monaghan,null,null
21,Tron,172062763,6.8,49,"The son of a virtual world designer goes looking for his father and ends up inside the digital world that his father designed. He meets his father's corrupted creation and a unique ally who was born inside the digital world.",125 min,283358,PG,4,2010,1,Action, Adventure, Sci-Fi            ,Joseph Kosinski,21,Joseph Kosinski, Jeff Bridges, Garrett Hedlund, Olivia Wilde,null,null
22,True Grit,171243005,7.6,80,"A stubborn teenager enlists the help of a tough U.S. Marshal to track down her father's murderer.",110 min,265913,PG-13,1,2010,1,Adventure, Drama, Western            ,Ethan Coen,22,Ethan Coen, Joel Coen, Jeff Bridges, Matt Damon, Hailee Steinfeld,null
23,Salt,118311368,6.4,65,"A CIA agent goes on the run after a defector accuses her of being a Russian spy.",100 min,264690,PG-13,1,2010,1,Action, Crime, Mystery            ,Phillip Noyce,23,Phillip Noyce, Angelina Jolie, Liev Schreiber, Chiwetel Ejiofor,null,null
24,RED,90380162,7.1,60,"When his peaceful life is threatened by a high-tech assassin, former black-ops agent Frank Moses reassembles his old team in a last ditch effort to survive and uncover his assailants.",111 min,259252,PG-13,1,2010,1,Action, Comedy, Crime            ,Robert Schwentke,24,Robert Schwentke, Bruce Willis, Helen Mirren, Morgan Freeman,null,null
25,The Book of Eli,94835059,6.9,53,"A post-apocalyptic tale, in which a lone man fights his way across America in order to protect a sacred book that holds the secrets to saving humankind.",118 min,252818,R,2,2010,1,Action, Adventure, Drama            ,Albert Hughes,25,Albert Hughes, Allen Hughes, Denzel Washington, Mila Kunis, Ray Stevenson,null
26,Clash of the Titans,163214888,5.8,39,"Perseus demigod, son of Zeus, battles the minions of the underworld to stop them from conquering heaven and earth.",106 min,245823,PG-13,1,2010,1,Action, Adventure, Fantasy            ,Louis Leterrier,26,Louis Leterrier, Sam Worthington, Liam Neeson, Ralph Fiennes,null,null
27,Prince of Persia: The Sands of Time,90759676,6.6,50,"A young fugitive prince and princess must stop a villain who unknowingly threatens to destroy the world with a special dagger that enables the magic sand inside to reverse time.",116 min,242323,PG-13,1,2010,1,Action, Adventure, Fantasy            ,Mike Newell,27,Mike Newell, Jake Gyllenhaal, Gemma Arterton, Ben Kingsley,null,null
28,Insidious,54009150,6.8,52,"A family looks to prevent evil spirits from trapping their comatose child in a realm called The Further.",103 min,234174,PG-13,1,2010,1,Horror, Mystery, Thriller            ,James Wan,28,James Wan, Patrick Wilson, Rose Byrne, Ty Simpkins,null,null
29,Robin Hood,105269730,6.7,53,"In 12th century England, Robin and his band of marauders confront corruption in a local village and lead an uprising against the crown that will forever alter the balance of world power.",140 min,228779,PG-13,1,2010,1,Action, Adventure, Drama            ,Ridley Scott,29,Ridley Scott, Russell Crowe, Cate Blanchett, Matthew Macfadyen,null,null
30,The A-Team,77222099,6.8,47,"A group of Iraq War veterans looks to clear their name with the U.S. Military, who suspect the four men of committing a crime for which they were framed.",117 min,226100,PG-13,1,2010,1,Action, Adventure, Comedy            ,Joe Carnahan,30,Joe Carnahan, Liam Neeson, Bradley Cooper, Sharlto Copley,null,null
31,The Other Guys,119219978,6.7,64,"Two mismatched New York City detectives seize an opportunity to step up like the city's top cops, whom they idolize, only things don't quite go as planned.",107 min,208857,PG-13,1,2010,1,Action, Comedy, Crime            ,Adam McKay,31,Adam McKay, Will Ferrell, Mark Wahlberg, Derek Jeter,null,null
32,The Twilight Saga: Eclipse,300531751,5,58,"As a string of mysterious killings grips Seattle, Bella, whose high school graduation is fast approaching, is forced to choose between her love for vampire Edward and her friendship with werewolf Jacob.",124 min,199838,PG-13,1,2010,1,Adventure, Drama, Fantasy            ,David Slade,32,David Slade, Kristen Stewart, Robert Pattinson, Taylor Lautner,null,null
33,Grown Ups,162001186,6,30,"After their high school basketball coach passes away, five good friends and former teammates reunite for a Fourth of July holiday weekend.",102 min,198764,PG-13,1,2010,1,Comedy            ,null,null,Dennis Dugan,33,Dennis Dugan, Adam Sandler, Salma Hayek, Kevin James,null,null
34,The Tourist,67631157,6,37,"Revolves around Frank, an American tourist visiting Italy to mend a broken heart. Elise is an extraordinary woman who deliberately crosses his path.",103 min,194863,PG-13,1,2010,1,Action, Adventure, Crime            ,Florian Henckel von Donnersmarck,34,Florian Henckel von Donnersmarck, Johnny Depp, Angelina Jolie, Paul Bettany,null,null
35,Megamind,148415853,7.3,63,"The supervillain Megamind finally defeats his nemesis, the superhero Metro Man. But without a hero, he loses all purpose and must find new meaning to his life.",95 min,193047,PG,4,2010,1,Animation, Action, Comedy            ,Tom McGrath,35,Tom McGrath, Will Ferrell, Jonah Hill, Brad Pitt,null,null
36,Predators,52000688,6.4,51,"A group of elite warriors parachute into an unfamiliar jungle and are hunted by members of a merciless alien race.",107 min,186235,R,2,2010,1,Action, Adventure, Sci-Fi            ,Nimrí__d Antal,36,Nimrí__d Antal, Adrien Brody, Laurence Fishburne, Topher Grace,null,null
37,Machete,26593646,6.6,60,"After being set-up and betrayed by the man who hired him to assassinate a Texas Senator, an ex-Federale launches a brutal rampage of revenge against his former boss.",105 min,175844,R,2,2010,1,Action, Crime, Thriller            ,Ethan Maniquis,37,Ethan Maniquis, Robert Rodriguez, Danny Trejo, Michelle Rodriguez, Robert De Niro,null
38,Unstoppable,81562942,6.8,69,"With an unmanned, half-mile-long freight train barreling toward a city, a veteran engineer and a young conductor race against the clock to prevent a catastrophe.",98 min,163950,PG-13,1,2010,1,Action, Thriller            ,null,Tony Scott,38,Tony Scott, Denzel Washington, Chris Pine, Rosario Dawson,null,null
39,Knight and Day,76423035,6.3,46,"A young woman gets mixed up with a disgraced spy who is trying to clear his name.",109 min,160790,PG-13,1,2010,1,Action, Adventure, Comedy            ,James Mangold,39,James Mangold, Tom Cruise, Cameron Diaz, Peter Sarsgaard,null,null
40,Blue Valentine,9737892,7.4,81,"The relationship of a contemporary married couple, charting their evolution over a span of years by cross-cutting between time periods.",112 min,159564,R,2,2010,1,Drama, Romance            ,null,Derek Cianfrance,40,Derek Cianfrance, Ryan Gosling, Michelle Williams, John Doman,null,null
41,The Next Three Days,21148651,7.4,52,"A married couple's life is turned upside down when the wife is accused of a murder.",133 min,158861,PG-13,1,2010,1,Action, Crime, Drama            ,Paul Haggis,41,Paul Haggis, Russell Crowe, Elizabeth Banks, Liam Neeson,null,null
42,Love & Other Drugs,32367005,6.7,55,"A young woman suffering from Parkinson's befriends a drug rep working for Pfizer in 1990s Pittsburgh.",112 min,158188,R,2,2010,1,Comedy, Drama, Romance            ,Edward Zwick,42,Edward Zwick, Jake Gyllenhaal, Anne Hathaway, Judy Greer,null,null
43,Get Him to the Greek,60974475,6.4,65,"A record company intern is hired to accompany out-of-control British rock star Aldous Snow to a concert at L.A.'s Greek Theater.",109 min,156111,R,2,2010,1,Adventure, Comedy, Music            ,Nicholas Stoller,43,Nicholas Stoller, Jonah Hill, Russell Brand, Elisabeth Moss,null,null
44,Percy Jackson & the Olympians: The Lightning Thief,88761720,5.9,47,"A teenager discovers he's the descendant of a Greek god and sets out on an adventure to settle an on-going battle between the gods.",118 min,155868,PG,4,2010,1,Adventure, Family, Fantasy            ,Chris Columbus,44,Chris Columbus, Logan Lerman, Kevin McKidd, Steve Coogan,null,null
45,Shrek Forever After,238371987,6.3,58,"Rumpelstiltskin tricks a mid-life crisis burdened Shrek into allowing himself to be erased from existence and cast in a dark alternate timeline where Rumpel rules supreme.",93 min,154655,PG,4,2010,1,Animation, Adventure, Comedy            ,Mike Mitchell,45,Mike Mitchell, Mike Myers, Cameron Diaz, Eddie Murphy,null,null
46,Hot Tub Time Machine,50287556,6.4,63,"A malfunctioning time machine at a ski resort takes a man back to 1986 with his two friends and nephew, where they must relive a fateful night and not change anything to make sure the nephew is born.",101 min,147949,R,2,2010,1,Comedy, Sci-Fi            ,null,Steve Pink,46,Steve Pink, John Cusack, Rob Corddry, Craig Robinson,null,null
47,Resident Evil: Afterlife,60128566,5.9,37,"While still out to destroy the evil Umbrella Corporation, Alice joins a group of survivors living in a prison surrounded by the infected who also want to relocate to the mysterious but supposedly unharmed safe haven known only as Arcadia.",96 min,146402,R,2,2010,1,Action, Adventure, Horror            ,Paul W.S. Anderson,47,Paul W.S. Anderson, Milla Jovovich, Ali Larter, Wentworth Miller,null,null
48,Tucker and Dale vs Evil,223838,7.6,65,"Affable hillbillies Tucker and Dale are on vacation at their dilapidated mountain cabin when they are mistaken for murderers by a group of preppy college students.",89 min,144580,R,2,2010,1,Comedy, Horror            ,null,Eli Craig,48,Eli Craig, Tyler Labine, Alan Tudyk, Katrina Bowden,null,null
49,The Ghost Writer,15541549,7.2,77,"A ghost writer, hired to complete the memoirs of a former British Prime Minister, uncovers secrets that put his own life in jeopardy.",128 min,142672,PG-13,1,2010,1,Drama, Mystery, Thriller            ,Roman Polanski,49,Roman Polanski, Ewan McGregor, Pierce Brosnan, Olivia Williams,null,null
50,Date Night,98711404,6.3,56,"In New York City, a case of mistaken identity turns a bored married couple's attempt at a glamorous and romantic evening into something more thrilling and dangerous.",88 min,138133,PG-13,1,2010,1,Comedy, Crime, Romance            ,Shawn Levy,50,Shawn Levy, Steve Carell, Tina Fey, Mark Wahlberg,null,null
51,The Sorcerer's Apprentice,63150991,6.1,46,"Master sorcerer Balthazar Blake must find and train Merlin's descendant to defeat dark sorceress Morgana la Fê©e.",109 min,136461,PG,4,2010,1,Action, Adventure, Family            ,Jon Turteltaub,51,Jon Turteltaub, Nicolas Cage, Jay Baruchel, Alfred Molina,null,null
52,The Karate Kid,176591618,6.2,61,"Work causes a single mother to move to China with her young son; in his new home, the boy embraces kung fu, taught to him by a master.",140 min,136029,PG,4,2010,1,Action, Drama, Family            ,Harald Zwart,52,Harald Zwart, Jackie Chan, Jaden Smith, Taraji P. Henson,null,null
53,Buried,1028658,7,65,"Paul is a U.S. truck driver working in Iraq. After an attack by a group of Iraqis he wakes to find he is buried alive inside a coffin. With only a lighter and a cell phone it's a race against time to escape this claustrophobic death trap.",95 min,131145,R,2,2010,1,Drama, Mystery, Thriller            ,Rodrigo Cortí_Œ©s,53,Rodrigo Cortí_Œ©s, Ryan Reynolds, Josí_Œ© Luis Garcí__a Pí_Œ©rez, Robert Paterson,null,null
54,The Last Airbender,131564731,4.2,20,"Follows the adventures of Aang, a young successor to a long line of Avatars, who must master all four elements and stop the Fire Nation from enslaving the Water Tribes and the Earth Kingdom.",103 min,129880,PG,4,2010,1,Action, Adventure, Family            ,M. Night Shyamalan,54,M. Night Shyamalan, Noah Ringer, Nicola Peltz, Jackson Rathbone,null,null
55,Remember Me,19068240,7.2,40,"A romantic drama centered on two new lovers: Tyler, whose parents have split in the wake of his brother's suicide, and Ally, who lives each day to the fullest since witnessing her mother's murder.",113 min,123709,PG-13,1,2010,1,Drama, Romance            ,null,Allen Coulter,55,Allen Coulter, Robert Pattinson, Emilie de Ravin, Caitlyn Rund,null,null
56,Never Let Me Go,2434652,7.2,69,"The lives of three friends, from their early school days into young adulthood, when the reality of the world they live in comes knocking.",103 min,123068,R,2,2010,1,Drama, Romance, Sci-Fi            ,Mark Romanek,56,Mark Romanek, Keira Knightley, Carey Mulligan, Andrew Garfield,null,null
57,Winter's Bone,6531503,7.2,90,"An unflinching Ozark Mountain girl hacks through dangerous social terrain as she hunts down her drug-dealing father while trying to keep her family intact.",100 min,120876,R,2,2010,1,Drama            ,null,null,Debra Granik,57,Debra Granik, Jennifer Lawrence, John Hawkes, Garret Dillahunt,null,null
58,The Chronicles of Narnia: The Voyage of the Dawn Treader,104386950,6.3,53,"Lucy and Edmund Pevensie return to Narnia with their cousin Eustace where they meet up with Prince Caspian for a trip across the sea aboard the royal ship The Dawn Treader. Along the way they encounter dragons, dwarves, merfolk, and a band of lost warriors before reaching the edge of the world.",113 min,119707,PG,4,2010,1,Adventure, Family, Fantasy            ,Michael Apted,58,Michael Apted, Ben Barnes, Skandar Keynes, Georgie Henley,null,null
59,Dear John,80014842,6.3,43,"A romantic drama about a soldier who falls for a conservative college student while he's home on leave.",108 min,119322,PG-13,1,2010,1,Drama, Romance, War            ,Lasse Hallstrí__m,59,Lasse Hallstrí__m, Channing Tatum, Amanda Seyfried, Richard Jenkins,null,null
60,It's Kind of a Funny Story,6350058,7.1,63,"A clinically depressed teenager gets a new start after he checks himself into an adult psychiatric ward.",101 min,119088,PG-13,1,2010,1,Comedy, Drama, Romance            ,Anna Boden,60,Anna Boden, Ryan Fleck, Keir Gilchrist, Zach Galifianakis, Emma Roberts,null
61,Green Zone,35053660,6.8,63,"Discovering covert and faulty intelligence causes a U.S. Army officer to go rogue as he hunts for Weapons of Mass Destruction in an unstable region.",115 min,118131,R,2,2010,1,Action, Drama, Thriller            ,Paul Greengrass,61,Paul Greengrass, Matt Damon, Jason Isaacs, Greg Kinnear,null,null
62,The Kids Are All Right,20811365,7,86,"Two children conceived by artificial insemination bring their biological father into their non-traditional family life.",106 min,117159,R,2,2010,1,Comedy, Drama, Romance            ,Lisa Cholodenko,62,Lisa Cholodenko, Annette Bening, Julianne Moore, Mark Ruffalo,null,null
63,Devil,33583175,6.2,44,"A group of people are trapped in an elevator and the Devil is mysteriously amongst them.",80 min,115395,PG-13,1,2010,1,Horror, Mystery, Thriller            ,John Erick Dowdle,63,John Erick Dowdle, Chris Messina, Caroline Dhavernas, Bokeem Woodbine,null,null
64,She's Out of My League,31584722,6.4,46,"An average Joe meets the perfect woman, but his lack of confidence and the influence of his friends and family begin to pick away at the relationship.",104 min,109563,R,2,2010,1,Comedy, Romance            ,null,Jim Field Smith,64,Jim Field Smith, Jay Baruchel, Alice Eve, T.J. Miller,null,null
65,Life as We Know It,53374681,6.6,39,"Two single adults become caregivers to an orphaned girl when their mutual best friends die in an accident.",114 min,106392,PG-13,1,2010,1,Comedy, Drama, Romance            ,Greg Berlanti,65,Greg Berlanti, Katherine Heigl, Josh Duhamel, Josh Lucas,null,null
66,The Bounty Hunter,67061228,5.5,22,"A bounty hunter learns that his next target is his ex-wife, a reporter working on a murder cover-up. Soon after their reunion, the always-at-odds duo find themselves on a run-for-their-lives adventure.",110 min,106276,PG-13,1,2010,1,Action, Comedy, Romance            ,Andy Tennant,66,Andy Tennant, Jennifer Aniston, Gerard Butler, Gio Perez,null,null
67,Incendies,6857096,8.2,80,"Twins journey to the Middle East to discover their family history, and fulfill their mother's last wishes.",131 min,106205,R,2,2010,1,Drama, Mystery, War            ,Denis Villeneuve,67,Denis Villeneuve, Lubna Azabal, Mí_Œ©lissa Dí_Œ©sormeaux-Poulin, Maxim Gaudette,null,null
68,From Paris with Love,23979741,6.5,42,"In Paris, a young employee in the office of the US Ambassador hooks up with an American spy looking to stop a terrorist attack in the city.",92 min,103532,R,2,2010,1,Action, Crime, Thriller            ,Pierre Morel,68,Pierre Morel, John Travolta, Jonathan Rhys Meyers, Kasia Smutniak,null,null
69,Valentine's Day,110485654,5.7,34,"Intertwining couples and singles in Los Angeles break-up and make-up based on the pressures and expectations of Valentine's Day.",125 min,102411,PG-13,1,2010,1,Comedy, Romance            ,null,Garry Marshall,69,Garry Marshall, Julia Roberts, Jamie Foxx, Anne Hathaway,null,null
70,Let Me In,12134420,7.2,79,"A bullied young boy befriends a young female vampire who lives in secrecy with her guardian.",116 min,101173,R,2,2010,1,Drama, Fantasy, Horror            ,Matt Reeves,70,Matt Reeves, Kodi Smit-McPhee, Chloí_Œ‰ Grace Moretz, Richard Jenkins,null,null
71,The Crazies,39123589,6.5,55,"About the inhabitants of a small Iowa town suddenly plagued by insanity and then death after a mysterious toxin contaminates their water supply.",101 min,100036,R,2,2010,1,Horror, Thriller            ,null,Breck Eisner,71,Breck Eisner, Radha Mitchell, Timothy Olyphant, Danielle Panabaker,null,null
72,The Way Back,2701859,7.3,66,"Siberian gulag escapees travel 4,000 miles by foot to freedom in India.",133 min,96747,PG-13,1,2010,1,Adventure, Drama, History            ,Peter Weir,72,Peter Weir, Jim Sturgess, Ed Harris, Colin Farrell,null,null
73,The Wolfman,61979680,5.8,43,"Upon his return to his ancestral homeland, an American man is bitten, and subsequently cursed by, a werewolf.",103 min,94414,R,2,2010,1,Drama, Fantasy, Horror            ,Joe Johnston,73,Joe Johnston, Benicio Del Toro, Anthony Hopkins, Emily Blunt,null,null
74,Little Fockers,148383780,5.5,27,"Family-patriarch Jack Byrnes wants to appoint a successor. Does his son-in-law, the male nurse Greg Focker, have what it takes?",98 min,93871,PG-13,1,2010,1,Comedy, Romance            ,null,Paul Weitz,74,Paul Weitz, Ben Stiller, Teri Polo, Robert De Niro,null,null
75,Repo Men,13794835,6.3,32,"Set in the near future when artificial organs can be bought on credit, it revolves around a man who struggles to make the payments on a heart he has purchased. He must therefore go on the run before said ticker is repossessed.",111 min,92917,R,2,2010,1,Action, Crime, Sci-Fi            ,Miguel Sapochnik,75,Miguel Sapochnik, Jude Law, Forest Whitaker, Alice Braga,null,null
